{
  "schema_version": 1,
  "status": "locked",
  "profile": "cobbleventure-dev",
  "minecraft": {
    "version": "1.21.1",
    "loader": {
      "type": "neoforge",
      "version": "21.1.248"
    }
  },
  "mods": [
    {
      "id": "cobblemon",
      "display_name": "Cobblemon",
      "classification": "required",
      "side": "both",
      "enabled": true,
      "version": "1.7.3",
      "curseforge": {
        "project_id": 687131,
        "file_id": 7553231
      },
      "reason": "포켓몬, 파티와 실제 배틀 시스템"
    },
    {
      "id": "cobblenav",
      "display_name": "Cobblemon Pokenav",
      "classification": "required",
      "side": "both",
      "enabled": true,
      "version": "2.3.3",
      "curseforge": {
        "project_id": 976014,
        "file_id": 7940651
      },
      "reason": "플레이어 메뉴의 포켓네비와 지역별 포켓몬 출현 정보"
    },
    {
      "id": "cloth_config",
      "display_name": "Cloth Config API",
      "classification": "required",
      "side": "both",
      "enabled": true,
      "version": "15.0.140",
      "curseforge": {
        "project_id": 348521,
        "file_id": 5729127
      },
      "reason": "Cobblemon Casino 2.0.0의 필수 설정 화면 API"
    },
    {
      "id": "kotlin_for_forge",
      "display_name": "Kotlin for Forge",
      "classification": "required",
      "side": "both",
      "enabled": true,
      "version": "5.11.0",
      "curseforge": {
        "project_id": 351264,
        "file_id": 7471280
      },
      "reason": "Cobblemon NeoForge의 필수 Kotlin 런타임"
    },
    {
      "id": "sinytra_connector",
      "display_name": "Sinytra Connector",
      "classification": "required",
      "side": "both",
      "enabled": true,
      "version": "2.0.0-beta.14+1.21.1",
      "curseforge": {
        "project_id": 890127,
        "file_id": 7634148
      },
      "reason": "NeoForge에서 Cobblemon Additions Fabric JAR을 로딩하는 호환층"
    },
    {
      "id": "forgified_fabric_api",
      "display_name": "Forgified Fabric API",
      "classification": "required",
      "side": "both",
      "enabled": true,
      "version": "0.116.7+2.2.1+1.21.1",
      "curseforge": {
        "project_id": 889079,
        "file_id": 7575945
      },
      "reason": "Cobblemon Additions가 요구하는 Fabric API를 NeoForge에서 제공"
    },
    {
      "id": "fabric_language_kotlin",
      "display_name": "Fabric Language Kotlin",
      "classification": "required",
      "side": "both",
      "enabled": true,
      "version": "1.13.8+kotlin.2.3.0",
      "curseforge": {
        "project_id": 308769,
        "file_id": 7340876
      },
      "reason": "Connector 위에서 Cobblemon Additions의 Fabric Kotlin 진입점을 실행"
    },
    {
      "id": "cobbledollars",
      "display_name": "CobbleDollars",
      "classification": "required",
      "side": "both",
      "enabled": true,
      "version": "2.0.0+Beta-5.1+1.21.1",
      "curseforge": {
        "project_id": 859232,
        "file_id": 6604564
      },
      "reason": "Cobblemon Additions 상점과 백화점의 화폐 및 상인 기능"
    },
    {
      "id": "cobblemon_casino",
      "display_name": "Cobblemon Casino",
      "classification": "required",
      "side": "both",
      "enabled": true,
      "version": "2.0.0",
      "curseforge": {
        "project_id": 1572769,
        "file_id": 8235485
      },
      "reason": "슬롯머신, 블랙잭, 가챠와 카지노 칩 경제를 제공하는 기본 카지노 시설"
    },
    {
      "id": "architectury_api",
      "display_name": "Architectury API",
      "classification": "required",
      "side": "both",
      "enabled": true,
      "version": "13.0.8",
      "curseforge": {
        "project_id": 419699,
        "file_id": 5786327
      },
      "reason": "CobbleFurnies 1.0의 필수 공용 API"
    },
    {
      "id": "rctapi",
      "display_name": "Radical Cobblemon Trainers API",
      "classification": "required",
      "side": "both",
      "enabled": true,
      "version": "0.15.2-beta",
      "curseforge": {
        "project_id": 1152792,
        "file_id": 7952419
      },
      "reason": "트레이너 데이터와 전투 연동 계약"
    },
    {
      "id": "rctmod",
      "display_name": "Radical Cobblemon Trainers",
      "classification": "required",
      "side": "both",
      "enabled": true,
      "version": "0.18.1-beta",
      "curseforge": {
        "project_id": 1009534,
        "file_id": 7913180
      },
      "reason": "RCT 트레이너 JSON 로딩과 트레이너전 관리"
    },
    {
      "id": "cobblefurnies",
      "display_name": "CobbleFurnies",
      "classification": "required",
      "side": "both",
      "enabled": true,
      "version": "1.0",
      "curseforge": {
        "project_id": 1188698,
        "file_id": 7302031
      },
      "reason": "Radical Gyms & Structures 체육관과 리그가 사용하는 가구 블록"
    },
    {
      "id": "athena",
      "display_name": "Athena",
      "classification": "required",
      "side": "client",
      "enabled": true,
      "version": "4.0.6",
      "curseforge": {
        "project_id": 841890,
        "file_id": 8061947
      },
      "reason": "CobbleFurnies 포켓볼 양탄자와 연결 텍스처 모델 렌더링"
    },
    {
      "id": "radical_gyms_structures",
      "display_name": "Radical Gyms & Structures",
      "classification": "required",
      "side": "both",
      "enabled": true,
      "version": "0.6",
      "curseforge": {
        "project_id": 1402174,
        "file_id": 7330950
      },
      "reason": "마을에 직접 배치하는 원본 체육관과 리그 구조물"
    },
    {
      "id": "mega_showdown",
      "display_name": "Cobblemon: Mega Showdown",
      "classification": "required",
      "side": "both",
      "enabled": true,
      "version": "1.9.3+1.7.3+1.21.1",
      "curseforge": {
        "project_id": 1189523,
        "file_id": 8519042
      },
      "reason": "Cobblemon 1.7.3용 메가진화, Z기술, 테라스탈, 다이맥스와 울트라버스트"
    },
    {
      "id": "accessories",
      "display_name": "Accessories",
      "classification": "required",
      "side": "both",
      "enabled": true,
      "version": "1.1.0-beta.52+1.21.1",
      "curseforge": {
        "project_id": 938917,
        "file_id": 7046407
      },
      "reason": "Mega Showdown 장신구 슬롯과 장착 렌더링 필수 의존성"
    },
    {
      "id": "owo_lib",
      "display_name": "oωo (owo-lib)",
      "classification": "required",
      "side": "both",
      "enabled": true,
      "version": "0.12.15.1-beta.3+1.21",
      "curseforge": {
        "project_id": 532610,
        "file_id": 6416633
      },
      "reason": "Mega Showdown과 Accessories의 GUI·설정·네트워크 필수 라이브러리"
    },
    {
      "id": "paxi_neoforge",
      "display_name": "Paxi (NeoForge)",
      "classification": "required",
      "side": "both",
      "enabled": true,
      "version": "5.1.3",
      "curseforge": {
        "project_id": 1015157,
        "file_id": 6485740
      },
      "reason": "Complete Cobblemon Collection과 ZA 보정팩을 모든 월드의 데이터팩 및 클라이언트 리소스팩으로 자동 로드"
    },
    {
      "id": "yungs_api_neoforge",
      "display_name": "YUNG's API (NeoForge)",
      "classification": "required",
      "side": "both",
      "enabled": true,
      "version": "5.1.6",
      "curseforge": {
        "project_id": 1015100,
        "file_id": 6715463
      },
      "reason": "Paxi 5.1.3이 요구하는 YUNG 공용 API 5.1.4 이상"
    },
    {
      "id": "easy_npc_bundle",
      "display_name": "Easy NPC Bundle",
      "classification": "required",
      "side": "both",
      "enabled": true,
      "version": "7.0.1",
      "curseforge": {
        "project_id": 559312,
        "file_id": 8420470
      },
      "reason": "Easy NPC Core와 Config UI 의존성을 선언하는 런처용 번들"
    },
    {
      "id": "easy_npc",
      "display_name": "Easy NPC Core",
      "classification": "required",
      "side": "both",
      "enabled": true,
      "version": "7.0.1",
      "curseforge": {
        "project_id": 1308987,
        "file_id": 8420476
      },
      "reason": "트레이너 의상 프리셋, 장비, 어린이 체형 NPC"
    },
    {
      "id": "easy_npc_config_ui",
      "display_name": "Easy NPC Config UI",
      "classification": "required",
      "side": "both",
      "enabled": true,
      "version": "7.0.1",
      "curseforge": {
        "project_id": 1214728,
        "file_id": 8420458
      },
      "reason": "Easy NPC 호환 프로필의 게임 내 설정과 네트워크"
    },
    {
      "id": "tbcs",
      "display_name": "Cobblemon Trainer Battle Commands",
      "classification": "required",
      "side": "both",
      "enabled": true,
      "version": "0.14.1-beta",
      "curseforge": {
        "project_id": 1172731,
        "file_id": 7858400
      },
      "reason": "EasyNPC와 RCT API 트레이너를 명령 기반 전투로 연결"
    }
  ],
  "content_packs": [
    {
      "id": "cobblemon_additions",
      "display_name": "Cobblemon Additions",
      "kind": "datapack",
      "classification": "required",
      "side": "both",
      "selected": true,
      "version": "4.2.1",
      "artifact_format": "fabric_mod",
      "packaging_status": "ready",
      "runtime_status": "ready",
      "modrinth": {
        "project_id": "W2pr9jyL",
        "version_id": "9PMzbD4o"
      },
      "install_path": "mods",
      "vendored_path": "pack/overrides/development-placeholder/mods/cobblemon-additions-4.2.1.jar",
      "source_url": "https://cdn.modrinth.com/data/W2pr9jyL/versions/9PMzbD4o/cobblemon-additions-4.2.1.jar",
      "sha1": "8aff3ce2f13787b310af5293022c413daccdee4b",
      "sha512": "63bbba75a22081f8489e486c5dc7947c8556255022e9c3ac692d6ff252883c7d2d74692b1bdb663ce9d841042c9bcc38785815a7bd0a40e9f89ccc7664d2c273",
      "license": "CC0-1.0",
      "reason": "마을, 포켓몬센터, 포켓마트와 백화점 콘텐츠; 원본 JAR은 개발팩에 포함했으며 NeoForge 실행에는 Fabric 호환층 추가가 필요함"
    }
  ]
}
